{"active_behavior_authorization":false,"content_sha256":"cfee17afcc28da35e657b2d1331bde68c752b5a3487f0af69087c12df6530b93","document_id":"adaptive_runtime_experiment_family_catalog_v5","document_version":5,"experiment_families":[{"actuation_proof_refs":["proof.application_send_batch_formation.single_eligible.reviewed_80113e61","proof.buffer_copy_coalescing.memory_conservative.reviewed_80113e61","proof.oversized_write_admission_quantum.single_fragment.runtime-proof-capture-20260727"],"blocked_experiment_types":["feedback_loop","profile_validation"],"constraint_refs":["constraint.send_admission_composition.multi_axis_capability"],"family_id":"send_admission_composition","fixed_axis_requirements":[{"axis_id":"application_send_turn_planning","configured_value":"legacy_current"},{"axis_id":"queued_send_burst_budget","configured_value":"legacy_current"}],"guardrail_metric_ids":["metric.correctness.logical_write_completion","metric.correctness.safety_fallback"],"history_reset_requirements":["history.send_admission.reset_each_correctness_cell"],"included_axis_ids":["application_send_batch_formation","buffer_copy_coalescing","oversized_write_admission_quantum"],"measurement_authorized":false,"outer_context_ids":["context.send_admission.legacy_selector_band","context.send_admission.legal_prefix_shape"],"predicate_refs":["predicate.batch.distinct_only_when_multiple_eligible","predicate.buffer.lower_only","predicate.oversized_write.activation"],"primary_metric_ids":["metric.correctness.mechanism_attribution"],"promotion_status":"deferred","relationship_refs":["edge.batch_to_buffer.supplies_work.v3","edge.oversized_to_batch.supplies_work.v3"],"supported_experiment_types":["actuation_validation","interaction_screen","isolated_counterfactual"],"workload_archetype_ids":["workload.send_admission.correctness_fixture"]},{"actuation_proof_refs":["proof.application_send_batch_formation.single_eligible.reviewed_80113e61","proof.buffer_copy_coalescing.memory_conservative.reviewed_80113e61"],"blocked_experiment_types":["feedback_loop","profile_validation"],"constraint_refs":["constraint.send_composition.multi_axis_capability"],"family_id":"send_composition","fixed_axis_requirements":[{"axis_id":"application_send_turn_planning","configured_value":"legacy_current"}],"guardrail_metric_ids":["metric.correctness.exact_release","metric.correctness.safety_fallback"],"history_reset_requirements":["history.send_composition.reset_each_correctness_cell"],"included_axis_ids":["application_send_batch_formation","buffer_copy_coalescing"],"measurement_authorized":false,"outer_context_ids":["context.send_composition.legal_prefix_shape","context.send_composition.ownership_lifecycle"],"predicate_refs":["predicate.batch.distinct_only_when_multiple_eligible","predicate.buffer.lower_only","predicate.family.send_composition.measurement_false"],"primary_metric_ids":["metric.correctness.mechanism_attribution"],"promotion_status":"deferred","relationship_refs":["edge.batch_to_buffer.supplies_work.v2"],"supported_experiment_types":["actuation_validation","interaction_screen","isolated_counterfactual"],"workload_archetype_ids":["workload.send_composition.correctness_fixture"]},{"actuation_proof_refs":["proof.queued_send_burst_budget.single_datagram.runtime-proof-capture-20260727"],"blocked_experiment_types":["feedback_loop","interaction_screen","profile_validation"],"constraint_refs":["constraint.queued_send_burst.single_axis"],"family_id":"queued_send_burst_correctness","fixed_axis_requirements":[{"axis_id":"application_send_batch_formation","configured_value":"legacy_current"},{"axis_id":"application_send_turn_planning","configured_value":"legacy_current"},{"axis_id":"buffer_copy_coalescing","configured_value":"legacy_current"},{"axis_id":"oversized_write_admission_quantum","configured_value":"legacy_current"}],"guardrail_metric_ids":["metric.correctness.transport_authority"],"history_reset_requirements":["history.queued_send.reset_each_correctness_cell"],"included_axis_ids":["queued_send_burst_budget"],"measurement_authorized":false,"outer_context_ids":["context.queued_send.legal_budget"],"predicate_refs":["predicate.queued_send.legal_budget_gt_one"],"primary_metric_ids":["metric.correctness.mechanism_attribution"],"promotion_status":"deferred","relationship_refs":[],"supported_experiment_types":["actuation_validation","isolated_counterfactual"],"workload_archetype_ids":["workload.queued_send.correctness_fixture"]},{"actuation_proof_refs":[],"blocked_experiment_types":["feedback_loop","interaction_screen","isolated_counterfactual","profile_validation"],"constraint_refs":["constraint.send_composition.multi_axis_capability"],"family_id":"send_planning_verification","fixed_axis_requirements":[{"axis_id":"application_send_batch_formation","configured_value":"legacy_current"},{"axis_id":"buffer_copy_coalescing","configured_value":"legacy_current"}],"guardrail_metric_ids":["metric.correctness.safety_fallback"],"history_reset_requirements":["history.send_planning.reset_each_correctness_cell"],"included_axis_ids":["application_send_turn_planning"],"measurement_authorized":false,"outer_context_ids":["context.send_planning.eligible_turn"],"predicate_refs":["predicate.send_turn.behavior_equivalent","predicate.send_turn.verification_only"],"primary_metric_ids":["metric.correctness.mechanism_attribution"],"promotion_status":"deferred","relationship_refs":["edge.batch_to_buffer.supplies_work.v2"],"supported_experiment_types":["actuation_validation"],"workload_archetype_ids":["workload.send_planning.correctness_fixture"]}],"performance_acceptance_authorization":false,"reviewed_actuation_proofs":[{"axis_id":"application_send_batch_formation","evidence_ref":{"document_id":"review.proof_candidate.application_send_batch_formation.single_eligible.v1.reviewed_80113e61","schema_version":"adaptive-runtime-actuation-proof-review-v1","document_version":1,"content_sha256":"f40368b49bfdc8607d22449e7e80e6c1dda03a611da2362909907710a6d24b37"},"policy_value":"single_eligible","proof_id":"proof.application_send_batch_formation.single_eligible.reviewed_80113e61","proof_version":1,"review_outcome":"passed"},{"axis_id":"buffer_copy_coalescing","evidence_ref":{"document_id":"review.proof_candidate.buffer_copy_coalescing.memory_conservative.v1.reviewed_80113e61","schema_version":"adaptive-runtime-actuation-proof-review-v1","document_version":1,"content_sha256":"da60ba782cd646f6c285ff1ef6dda877bc30c984054644f2bc501025e6c02408"},"policy_value":"memory_conservative","proof_id":"proof.buffer_copy_coalescing.memory_conservative.reviewed_80113e61","proof_version":1,"review_outcome":"passed"},{"axis_id":"oversized_write_admission_quantum","evidence_ref":{"document_id":"review.proof_candidate.oversized_write_admission_quantum.single_fragment.v3.runtime-proof-capture-20260727.v2","schema_version":"adaptive-runtime-actuation-proof-review-v2","document_version":2,"content_sha256":"2b444f8048d30a727a65d93b64bb25a138f9aca5e1b104c8b9900bf7a79df980"},"policy_value":"single_fragment","proof_id":"proof.oversized_write_admission_quantum.single_fragment.runtime-proof-capture-20260727","proof_version":1,"review_outcome":"passed"},{"axis_id":"queued_send_burst_budget","evidence_ref":{"document_id":"review.proof_candidate.queued_send_burst_budget.single_datagram.v3.runtime-proof-capture-20260727.v2","schema_version":"adaptive-runtime-actuation-proof-review-v2","document_version":2,"content_sha256":"00c8749a50fec9cc9392c65dcceb0575f303d2c68d771f01f2462f774706ea65"},"policy_value":"single_datagram","proof_id":"proof.queued_send_burst_budget.single_datagram.runtime-proof-capture-20260727","proof_version":1,"review_outcome":"passed"}],"schema_version":"adaptive-runtime-experiment-family-catalog-v4","trace_references":{"architecture_ids":["ARC-QUIC-CRT-0116"],"requirement_ids":["REQ-QUIC-CRT-0241","REQ-QUIC-CRT-0242"],"verification_ids":["VER-QUIC-CRT-0118"],"work_item_ids":["WI-QUIC-CRT-0117"]}}